{
  "schemaVersion": "alica-release/v1",
  "canonicalEncoding": "alica-canonical-json/v1",
  "releaseId": "rel_0198f3c0-7b00-7a11-8c21-4f5d6e7a8b90",
  "releaseVersion": "1.0.0-d1.fixture.1",
  "createdAt": "2026-08-27T20:00:00Z",
  "cellContract": "alica-cell/v0.1",
  "releaseClass": "development",
  "installable": false,
  "product": {
    "productId": "com.alica.community-dsh",
    "releaseLine": "1.0",
    "profile": "dsh-minimal/v1",
    "freezeDigest": "sha256:084ee1cfe6a16afcfac7178484afd359c7f9012d69552ce37839594a39c4b3b1",
    "binaryLicense": "ALICA-Community-DSH-EULA-1.0",
    "eulaDigest": "sha256:3b172e3850816750ff7b5a7d6d4b9f311f5c745159e201f42fea647c4dad1f3c",
    "centralRuntimeDependencies": []
  },
  "profiles": [
    "dsh-minimal/v1"
  ],
  "platforms": [
    {
      "osId": "debian",
      "osVersion": "13",
      "architecture": "amd64",
      "init": "systemd",
      "docker": {
        "minimumInclusive": "28.4.0",
        "maximumExclusive": "29.0.0"
      },
      "compose": {
        "minimumInclusive": "2.39.4",
        "maximumExclusive": "3.0.0"
      },
      "minimum": {
        "vcpu": 4,
        "memoryBytes": 8589934592,
        "freeDiskBytes": 107374182400
      },
      "upgradeHeadroomBytes": 21474836480
    }
  ],
  "sources": [
    {
      "repository": "BartSchuster22/UNIFY",
      "commit": "8aaa8ce6c738138e4b484cd6be43a5545263394b",
      "treeDigest": "sha256:6c7e80d2bb4791798d06eb7f16c07a916cc6d7ad5df760d91e0c610fb13e9417"
    },
    {
      "repository": "BartSchuster22/memory-v4",
      "commit": "6111107fa709826c0642651f7f256c0c7fe3116a",
      "treeDigest": "sha256:cb93f06749129b0143656f00fd3f14ed8aaac47a35822afa1761ef812c6f7df5"
    },
    {
      "repository": "BartSchuster22/doghouse",
      "commit": "8ce1b1c09c0a7f2b91d8c65a9c820a64e4cea271",
      "treeDigest": "sha256:3cbcb7f1701a7242023969dec1ec001f5adcf06a5df15c32fdd5bc3e182a75c8"
    },
    {
      "repository": "NousResearch/hermes-agent",
      "commit": "9e54eee44f1cbbe62247a36546e51ff8940373c6",
      "treeDigest": "sha256:0b051afe7003bacd7536d801969d7456ea7aaedd2f278a8637d2e18fc902fecd"
    }
  ],
  "components": [
    {
      "componentId": "caddy",
      "authority": "edge",
      "version": "2.8.4",
      "kind": "oci-image",
      "realization": "oci-container",
      "artifact": "oci://registry.fixture.invalid/alica/caddy@sha256:c56d0940f5bfa24db1258cc83e08f2aaa162dce0d8190a23ca2c1c147db662c3",
      "digest": "sha256:c56d0940f5bfa24db1258cc83e08f2aaa162dce0d8190a23ca2c1c147db662c3",
      "signaturePolicy": "alica-executable/v1",
      "sbom": {
        "id": "caddy-sbom-cyclonedx-1.6",
        "artifact": "oci://registry.fixture.invalid/alica-evidence/caddy-sbom-cyclonedx-1.6@sha256:e8c50aab9cc2dbb1d49ee95c0f8721c59a95c44d1f429e2e24d83a3f0e5d0897",
        "digest": "sha256:e8c50aab9cc2dbb1d49ee95c0f8721c59a95c44d1f429e2e24d83a3f0e5d0897"
      },
      "provenance": {
        "id": "caddy-provenance-slsa-v1",
        "artifact": "oci://registry.fixture.invalid/alica-evidence/caddy-provenance-slsa-v1@sha256:13abd27a1f137bf8ea5612aa352cce4e54397756be67169826221a205f723431",
        "digest": "sha256:13abd27a1f137bf8ea5612aa352cce4e54397756be67169826221a205f723431"
      },
      "componentContract": "caddy/v1",
      "provides": [
        "alica-https/v1"
      ],
      "requires": [],
      "configSchema": {
        "id": "caddy-config/v1",
        "digest": "sha256:4d6ac2d31e6baef3cec44a02a7bf6c403447eb960506efdb5b7aef7c140f61b8"
      },
      "dataSchema": {
        "authority": "edge",
        "target": "caddy-config/v1"
      }
    },
    {
      "componentId": "uniui",
      "authority": "uniui",
      "version": "1.0.0",
      "kind": "oci-image",
      "realization": "oci-container",
      "artifact": "oci://registry.fixture.invalid/alica/uniui@sha256:87a1dba43706e8aaccd4964743f840e7d9dba61148c36f61af2982b8a9ccfbd0",
      "digest": "sha256:87a1dba43706e8aaccd4964743f840e7d9dba61148c36f61af2982b8a9ccfbd0",
      "signaturePolicy": "alica-executable/v1",
      "sbom": {
        "id": "uniui-sbom-cyclonedx-1.6",
        "artifact": "oci://registry.fixture.invalid/alica-evidence/uniui-sbom-cyclonedx-1.6@sha256:8f6196a9b0095ed812ec882afa2cba83247fad68a0440c0cdcf5b72e55e15771",
        "digest": "sha256:8f6196a9b0095ed812ec882afa2cba83247fad68a0440c0cdcf5b72e55e15771"
      },
      "provenance": {
        "id": "uniui-provenance-slsa-v1",
        "artifact": "oci://registry.fixture.invalid/alica-evidence/uniui-provenance-slsa-v1@sha256:8adf4df6c4cb812208a8d02f5c1bc4dc0c179e13707489d41294d14205a63d11",
        "digest": "sha256:8adf4df6c4cb812208a8d02f5c1bc4dc0c179e13707489d41294d14205a63d11"
      },
      "componentContract": "uniui/v1",
      "provides": [
        "uniui-web/v1"
      ],
      "requires": [
        "unify-api/v1"
      ],
      "configSchema": {
        "id": "uniui-config/v1",
        "digest": "sha256:021f8376a02123fc8deb0b9060644552f7851d558e8c27832746672b4ab798f7"
      },
      "dataSchema": {
        "authority": "uniui",
        "target": "stateless/v1"
      }
    },
    {
      "componentId": "unify-core",
      "authority": "unify",
      "version": "1.0.0",
      "kind": "oci-image",
      "realization": "oci-container",
      "artifact": "oci://registry.fixture.invalid/alica/unify-core@sha256:9b6fac0bc000e9e3ff9316980870ad03e479df86ce49ae8571883141546faa2e",
      "digest": "sha256:9b6fac0bc000e9e3ff9316980870ad03e479df86ce49ae8571883141546faa2e",
      "signaturePolicy": "alica-executable/v1",
      "sbom": {
        "id": "unify-core-sbom-cyclonedx-1.6",
        "artifact": "oci://registry.fixture.invalid/alica-evidence/unify-core-sbom-cyclonedx-1.6@sha256:38b0295f7401c12afdec477e33a5b515695b20791afda253e36526fd52bd22c2",
        "digest": "sha256:38b0295f7401c12afdec477e33a5b515695b20791afda253e36526fd52bd22c2"
      },
      "provenance": {
        "id": "unify-core-provenance-slsa-v1",
        "artifact": "oci://registry.fixture.invalid/alica-evidence/unify-core-provenance-slsa-v1@sha256:6ea54f3a41aa1e5536e778d752f08c31a83318c0c99eb9f485b74ac8ff3b99a8",
        "digest": "sha256:6ea54f3a41aa1e5536e778d752f08c31a83318c0c99eb9f485b74ac8ff3b99a8"
      },
      "componentContract": "unify-core/v1",
      "provides": [
        "unify-api/v1"
      ],
      "requires": [
        "postgresql/v16",
        "keycloak-oidc/v1",
        "memory-v4-api/v1"
      ],
      "configSchema": {
        "id": "unify-core-config/v1",
        "digest": "sha256:4ba030d30fe52c43a6d8d4d084be21b2feb0dbf4a3c67ffe0de051345c82351c"
      },
      "dataSchema": {
        "authority": "unify",
        "target": "core-migrations/d1"
      }
    },
    {
      "componentId": "keycloak",
      "authority": "identity",
      "version": "26.0.8",
      "kind": "oci-image",
      "realization": "oci-container",
      "artifact": "oci://registry.fixture.invalid/alica/keycloak@sha256:3e041b6bf0dfa55fc98ad6a755d27dd946a2a8c513a06db678a4fe8f8adb3f39",
      "digest": "sha256:3e041b6bf0dfa55fc98ad6a755d27dd946a2a8c513a06db678a4fe8f8adb3f39",
      "signaturePolicy": "alica-executable/v1",
      "sbom": {
        "id": "keycloak-sbom-cyclonedx-1.6",
        "artifact": "oci://registry.fixture.invalid/alica-evidence/keycloak-sbom-cyclonedx-1.6@sha256:6d73de61924011c24833944354c5d9ea5f69113378db6b392c29e68b735b1c90",
        "digest": "sha256:6d73de61924011c24833944354c5d9ea5f69113378db6b392c29e68b735b1c90"
      },
      "provenance": {
        "id": "keycloak-provenance-slsa-v1",
        "artifact": "oci://registry.fixture.invalid/alica-evidence/keycloak-provenance-slsa-v1@sha256:fd39736215d23740a15cce4b91037002e74394e763d6fc4a378b94a9861b14be",
        "digest": "sha256:fd39736215d23740a15cce4b91037002e74394e763d6fc4a378b94a9861b14be"
      },
      "componentContract": "keycloak/v1",
      "provides": [
        "keycloak-oidc/v1"
      ],
      "requires": [
        "postgresql/v16"
      ],
      "configSchema": {
        "id": "keycloak-config/v1",
        "digest": "sha256:98bf4195db7b56e0a68d5c7b4009196103137b54016338e9c221b941be8a7fbb"
      },
      "dataSchema": {
        "authority": "identity",
        "target": "keycloak-schema/d1"
      }
    },
    {
      "componentId": "postgresql",
      "authority": "postgresql",
      "version": "16.10.0",
      "kind": "oci-image",
      "realization": "oci-container",
      "artifact": "oci://registry.fixture.invalid/alica/postgresql@sha256:30d027f5b086d2487f150fde79835c8fc26fdbeff2854b34038215b3607de2eb",
      "digest": "sha256:30d027f5b086d2487f150fde79835c8fc26fdbeff2854b34038215b3607de2eb",
      "signaturePolicy": "alica-executable/v1",
      "sbom": {
        "id": "postgresql-sbom-cyclonedx-1.6",
        "artifact": "oci://registry.fixture.invalid/alica-evidence/postgresql-sbom-cyclonedx-1.6@sha256:fce40f5351b2e831b361955c4e892d29539f3c89a0c82d42374fb04889375875",
        "digest": "sha256:fce40f5351b2e831b361955c4e892d29539f3c89a0c82d42374fb04889375875"
      },
      "provenance": {
        "id": "postgresql-provenance-slsa-v1",
        "artifact": "oci://registry.fixture.invalid/alica-evidence/postgresql-provenance-slsa-v1@sha256:110b8257de9c2564d8c1d1d681b30bd0eb45420521cc712655026cf4703ff9a1",
        "digest": "sha256:110b8257de9c2564d8c1d1d681b30bd0eb45420521cc712655026cf4703ff9a1"
      },
      "componentContract": "postgresql/v1",
      "provides": [
        "postgresql/v16"
      ],
      "requires": [],
      "configSchema": {
        "id": "postgresql-config/v1",
        "digest": "sha256:b8bf7d6576098d4f33971fc2dbc53936ca15c1ab25f8834bcdadd0739e5dcc1a"
      },
      "dataSchema": {
        "authority": "postgresql",
        "target": "postgresql-schema/d1"
      }
    },
    {
      "componentId": "alica-runtime",
      "authority": "alica",
      "version": "1.0.0",
      "kind": "oci-image",
      "realization": "oci-container",